Sr. No.,Job Title,Company Name,Experience Required,Salary,Location,Job Description,Key Skills
1,AI Engineer ,    Procter & Gamble  ( P&G ),3 - 6 yrs,,Mumbai,"P & G was founded over 180 years ago as a simple soap and candle company. Today ,  we're the worlds largest consumer goods company and home to iconic ,  trusted brands that ma","algorithms  ,  information technology  ,  artificial intelligence  ,  sql  ,  devops  ,  software engineering  ,  business applications  ,  python  ,  cloud services  ,  machine learning  ,  soap"
2,AI Engineer ,    Intel Technologies,5 - 8 yrs,,Bengaluru / Bangalore,"AI Engineer Job DescriptionIntel Emergent AI Research Lab is creating the next generation of AI systems ,  pushing the boundaries of research and technology to produce a posit","c    ,  software engineering  ,  image processing  ,  machine learning  ,  computer graphics  ,  written communication  ,  infrastructure"
3,AI Engineer ,    ikomet Technology Solutions Pvt. Ltd.,0 - 3 yrs,,Chennai,"AI EngineerWork Location: ChennaiRequired Experience: 3 - 5Job Description:Understand the business problem ,  challenge of existing technologies and areas of application for A","algorithms  ,  python  ,  os  ,  machine learning  ,  infrastructure  ,  linux  ,  opencv"
4,AI Engineer ,    innovation incubator advisory,0 - 3 yrs,,Thiruvananthapuram,Develop custom data models and algorithms to apply to data sets.Strong problem solving skills with an emphasis on product development.Experience using statistical computer lan,"algorithms  ,  python  ,  problem solving  ,  sql"
5,      Senior Principal AI Engineer ,    Intel Technology India Pvt Ltd,15 - 18 yrs,,Bengaluru / Bangalore,Senior Principal AI Engineer Job DescriptionPrincipal Engineers at the senior level at Intel that are active technical leaders inside and outside the company. Activities inclu,"Deep technical  ,  Principal AI Engineer  ,  Data Analysis"
6,AI Engineer / Specialist ,    taylor & francis group,5 - 8 yrs,,Bengaluru / Bangalore,The role of AI Engineer will join our team of technologists responsible for incubating new and novel software / data initiatives that drive growth and explore new markets for ,"algorithms  ,  c    ,  storage  ,  sql  ,  java  ,  python  ,  c  ,  natural language processing  ,  director  ,  microsoft azure  ,  problem solving  ,  machine learning"
7,      Lead AI Engineer ,    TARGET,3 - 6 yrs,,Bengaluru / Bangalore,This role is with Targets Search team which uses AI to power search on target.com. The Search team builds the core relevance engine and products that power Targets digital exp,"algorithms  ,  hql  ,  artificial intelligence  ,  sql  ,  java  ,  devops  ,  python  ,  information retrieval  ,  mobile  ,  machine learning"
8,"AI Engineer Bangalore ,  KA ",    Intel Technology India Pvt Ltd,5 - 8 yrs,,Bengaluru / Bangalore,"Job ID: JR0209962AI Engineer Job DescriptionIntel Emergent AI Research Lab is creating the next generation of AI systems ,  pushing the boundaries of research and technology t","c    ,  software engineering  ,  image processing  ,  machine learning  ,  computer graphics  ,  written communication  ,  infrastructure"
9,      Sr. AI-ML Engineer  /  AI-ML Engineer ,    L and T Technology Services,4 - 7 yrs,,Mysoru / Mysore,The Person will be responsible for leading the Medical Imaging and AI  /  ML CoE which is part of Medical Devices  &  Life Sciences  ( MDLS )  business. The position is a tech,"c    ,  software engineering  ,  itk  ,  python  ,  machine learning  ,  opengl  ,  opencv"
10,AI / ML Engineer ,    TECHNOPARK TRIVANDRUM,0 - 3 yrs,,Thiruvananthapuram,"""We are a global software solutions firm providing the full life cycle of capabilities from strategy through development ,  testing ,  maintenance and outsourcing. Techversant","artificial intelligence  ,  java  ,  software engineering  ,  moodle  ,  image processing  ,  python  ,  natural language processing  ,  machine learning  ,  javascript  ,  ruby  ,  php"
11,AI Frameworks Engineer ,    Intel Technology India Pvt Ltd,6 - 12 yrs,,"Hyderabad/Secunderabad,  Bengaluru / Bangalore","AI Frameworks Engineer Job DescriptionConducts design and development to build and optimize AI software. Designs ,  develops ,  tests and optimizes for AI frameworks  ( e.g. ,","cuda  ,  c    ,  python  ,  c  ,  machine learning  ,  compilers  ,  debugging  ,  software engineering  ,  software developer"
12,AI Frameworks Engineer ,    Intel Technologies,6 - 12 yrs,,"Hyderabad/Secunderabad,  Bengaluru / Bangalore","AI Frameworks Engineer Job DescriptionConducts design and development to build and optimize AI software. Designs ,  develops ,  tests and optimizes for AI frameworks  ( e.g. ,","cuda  ,  c    ,  python  ,  c  ,  machine learning  ,  compilers  ,  debugging  ,  software engineering  ,  software developer"
13,AI / ML Engineer ,    klearnow,0 - 3 yrs,,Gurgaon,"We are looking for is an experienced AI / ML Engineer who is self-driven and result oriented ,  a team player and able to work across teamsResponsibilities Design and develop ","algorithms  ,  artificial intelligence  ,  sql  ,  security  ,  digitization  ,  python  ,  natural language processing  ,  team player  ,  machine learning  ,  infrastructure"
14,AI / ML Engineer ,    CoreStack,5 - 8 yrs,,Chennai,Requirements Please apply only if you have hands-on expertise designing and installing simple to advanced Time Series Forecasting Models in the Python language. We're looking ,"algorithms  ,  docker  ,  security  ,  mongodb  ,  python  ,  cloud services  ,  machine learning  ,  nist  ,  nosql  ,  written communication"
15,AI / ML Engineer ,    TECHNOPARK TRIVANDRUM,0 - 3 yrs,,Thiruvananthapuram,Whats important to us:We are seeking experienced AI / ML Engineers who will be responsible for developing and driving new business opportunities internationally. The incumbent,"artificial intelligence  ,  java  ,  software engineering  ,  moodle  ,  image processing  ,  python  ,  natural language processing  ,  machine learning  ,  javascript  ,  ruby  ,  php"
16,AI ML Engineer ,    APPLYCUP HIRING SOLUTIONS LLP,2 - 10 yrs,,Chennai,"AI ML EngineerChennai ,  Tamil Nadu Qualification : B.Tech / M.Tech / M.E  / B.E / MCA / BCA / M.Sc / B.Sc , CS ,  Experience : 2 - 10 YearsSkills : python ,  JAVA ,  HTML ,  ","python  ,  java  ,  html  ,  sql"
17,      Senior AI / ML Engineer ,    Vehere,8 - 10 yrs,,Kolkata,"Job Summary:You will be part of the team that develops Veheres next-generation security product. Our groundbreaking technology ,  services delivery ,  and intelligence gatheri","fundamentals  ,  algorithms  ,  scala  ,  security  ,  database  ,  java  ,  apache  ,  linux  ,  data structures  ,  python  ,  machine learning  ,  nosql"
18,AI / ML Engineer ,    klearnow,0 - 3 yrs,,Gurgaon,"Responsibilities Develop innovative AI solutions for challenging business problems.Discover data sources ,  get access to them ,  import them ,  clean them up ,  and make them","algorithms  ,  python  ,  natural language processing  ,  team player  ,  machine learning  ,  sql  ,  security  ,  infrastructure"
19,AI - Senior Engineer ,    quality engineering pvt.ltd.jalgaon,5 - 8 yrs,,Thiruvananthapuram,Capture technical requirements from customerCommunicate directly with the customer on any technical issues and offer solutions whenever requiredWork jointly with the Research ,"algorithms  ,  python  ,  machine learning  ,  artificial intelligence"
20,AI Solution Engineer ,    Intel Technology India Pvt Ltd,6 - 9 yrs,,Bengaluru / Bangalore,"AI Solution Engineer Job DescriptionVSG is engaged in exploring opportunity in emerging Technology opportunity areas like Healthcare ,  Digital Economy ,  Education etc. The s","algorithms  ,  c    ,  system software  ,  graphics  ,  docker  ,  devops  ,  linux  ,  debugging  ,  software engineering  ,  business applications  ,  python  ,  c  ,  computer networks  ,  machine learning  ,  windows  ,  interconnect  ,  written communication  ,  sdl"
21,AI Solution Engineer ,    Intel Technologies,6 - 9 yrs,,Bengaluru / Bangalore,"AI Solution Engineer Job DescriptionVSG is engaged in exploring opportunity in emerging Technology opportunity areas like Healthcare ,  Digital Economy ,  Education etc. The s","algorithms  ,  c    ,  system software  ,  graphics  ,  docker  ,  devops  ,  linux  ,  debugging  ,  software engineering  ,  business applications  ,  python  ,  c  ,  computer networks  ,  machine learning  ,  windows  ,  interconnect  ,  written communication  ,  sdl"
22,AI Application Engineer ,    H2O.ai,3 - 5 yrs,,Chennai,Responsibilities and Duties:As an AI Application Engineer in H2O.ai Professional Services team you will work closely with Technical teams on the Customer side and Customer Suc,"fundamentals  ,  rest api  ,  sql  ,  database  ,  java  ,  linux  ,  cloud computing  ,  big data  ,  python  ,  os  ,  ubuntu  ,  microsoft azure  ,  machine learning  ,  nosql  ,  django"
23,AI Platforms Engineer ,    Intel Technology India Pvt Ltd,6 - 9 yrs,,Bengaluru / Bangalore,AI Platforms Engineer Job DescriptionThis is an exciting opportunity for an individual who is interested in joining AI Platforms team that is fast growing and strategically im,"information technology  ,  hosting  ,  storage  ,  database  ,  devops  ,  linux  ,  software engineering  ,  linux shell scripting  ,  python  ,  team player  ,  written communication  ,  splunk  ,  reporting tools"
24,AI Frameworks Engineer ,    Intel Technology India Pvt Ltd,0 - 3 yrs,,Bengaluru / Bangalore,"AI Frameworks Engineer Job DescriptionConducts design and development to build and optimize AI software. Designs ,  develops ,  and optimizes for AI frameworks  ( e.g. ,  Open","algorithms  ,  machine learning  ,  artificial intelligence  ,  data communication  ,  software engineering"
25,AI Software Solutions Engineer  ( AI Frameworks )  ,    Intel Technology India Pvt Ltd,3 - 6 yrs,,Bengaluru / Bangalore,"AI Software Solutions Engineer  ( AI Frameworks )  Job DescriptionWorks with internal engineering teams and external partners ,  customers ,  and ISVs to deliver optimized AI ","algorithms  ,  c    ,  gcc  ,  storage  ,  artificial intelligence  ,  software engineering  ,  python  ,  infrastructure"
26,AI Software Solutions Engineer  ( AI Frameworks )  ,    Intel Technologies,3 - 6 yrs,,Bengaluru / Bangalore,"AI Software Solutions Engineer  ( AI Frameworks )  Job DescriptionWorks with internal engineering teams and external partners ,  customers ,  and ISVs to deliver optimized AI ","algorithms  ,  c    ,  gcc  ,  storage  ,  artificial intelligence  ,  software engineering  ,  python  ,  infrastructure"
27,AI Software Solutions Engineer  ( AI Frameworks )  ,    Intel Technologies,3 - 6 yrs,,Bengaluru / Bangalore,"AI Software Solutions Engineer  ( AI Frameworks )  Job DescriptionWorks with internal engineering teams and external partners ,  customers ,  and ISVs to deliver optimized AI ","algorithms  ,  c    ,  gcc  ,  storage  ,  artificial intelligence  ,  software engineering  ,  python  ,  infrastructure"
28,AI Software Solutions Engineer  ( AI Frameworks )  ,    Intel Technology India Pvt Ltd,3 - 6 yrs,,Bengaluru / Bangalore,"AI Software Solutions Engineer  ( AI Frameworks )  Job DescriptionWorks with internal engineering teams and external partners ,  customers ,  and ISVs to deliver optimized AI ","algorithms  ,  c    ,  gcc  ,  storage  ,  artificial intelligence  ,  software engineering  ,  python  ,  infrastructure"
29,AI Software Solutions Engineer  ( AI Frameworks )  ,    Intel Technology India Pvt Ltd,3 - 6 yrs,,Bengaluru / Bangalore,"AI Software Solutions Engineer  ( AI Frameworks )  Job DescriptionWorks with internal engineering teams and external partners ,  customers ,  and ISVs to deliver optimized AI ","algorithms  ,  c    ,  gcc  ,  storage  ,  artificial intelligence  ,  software engineering  ,  python  ,  infrastructure"
30,AI Software Solutions Engineer  ( AI Frameworks )  ,    Intel Technology India Pvt Ltd,3 - 6 yrs,,Bengaluru / Bangalore,"AI Software Solutions Engineer  ( AI Frameworks )  Job DescriptionWe are looking for a dynamic software engineer to design ,  develop and optimize for performance ,  AI framew","algorithms  ,  c    ,  python  ,  gcc  ,  storage  ,  artificial intelligence  ,  infrastructure  ,  software engineering  ,  software engineer
 

"
31,      Vitis AI Engineer - Vision Accelerator Development ,    Xilinx India Technology Services Pvt Ltd,9 - 12 yrs,,Hyderabad/Secunderabad,"Vitis AI Vision is a library of AIE / HLS / RTL /  IPs and SW IPs which accelerate on FPGA vision algorithms with applications in ML Inference ,  ADAS ,  ISP and other areas.V","algorithms  ,  c    ,  signal processing  ,  compilers  ,  big data  ,  python  ,  c  ,  machine learning"
32,      Vitis AI Engineer - Vision Accelerator Development ,    Xilinx India Technology Services Pvt Ltd,9 - 12 yrs,,Hyderabad/Secunderabad,"At Xilinx ,  we are leading the industry transformation to build an adaptable ,  intelligent world. ARE YOU bold ,  collaborative ,  and creative? We develop leaders and innov","algorithms  ,  c    ,  signal processing  ,  compilers  ,  big data  ,  python  ,  c  ,  machine learning"
33,      Software Engineer AI / ML Platform ,    zerogons services pvt ltd,4 - 10 yrs,,Pune,"Technical: Solution selling knowledge ,  in particular for Big Data ,  AI ,  ML  &  Cloud solutions4-10 years of relevant sales experience  High achieving ,  ambitious ,  and ","Big Data  ,   AI  ,  Software Engineer  ,  promote strong  ,  "
34,      Software Engineer  ( AI / ML )  ,    APPLYCUP HIRING SOLUTIONS LLP,1 - 4 yrs,,Bengaluru / Bangalore,"Qualification : BE  , Btech  , BSC Computer / IT , MSC  , MCA , any graduate ,  Experience : 1 - 4 YearsSkills : AI and MLJob Description :Job description:-Requirements:1-4 Ye","algorithms  ,  python  ,  software engineer  ,  machine learning  ,  artificial intelligence"
35,      Senior Software Engineer - AI ,    quality engineering pvt.ltd.jalgaon,0 - 3 yrs,,Thiruvananthapuram,"Required Skills: Knowledge of machine learning  ( ML )  and statistical modeling concepts.deep knowledge of ML concepts for classification ,  regression ,  clustering ,  etc.A","python  ,  computer programming  ,  entry level  ,  debugging  ,  senior software engineer  ,  machine learning"
36,AI / ML Software Engineer ,    simplecrm,3 - 6 yrs,,"Mumbai,  Delhi,  Delhi/NCR,  Bengaluru / Bangalore",Expectations: The candidate should have a Bachelors / Masters degree in Computer Science Engineering or related field.3  years of overall software development experience and 1,"python  ,  natural language processing  ,  machine learning  ,  artificial neural networks  ,  security  ,  git  ,  web technologies  ,  software engineer  ,  technical skills"
37,AI Software Solutions Engineer ,    Intel Technology India Pvt Ltd,8 - 15 yrs,,Bengaluru / Bangalore,AI Software Solutions Engineer. Job DescriptionIntel DPG AI group focuses on developing disruptive solutions that will shape the future of AI and Deep Learning computing. Led ,"dsp  ,  c    ,  software design  ,  storage  ,  artificial intelligence  ,  git  ,  devops  ,  linux  ,  software engineering  ,  image processing  ,  python  ,  gdb  ,  c   programming  ,  unix"
38,AI Software Solutions Engineer ,    Intel Technologies,8 - 15 yrs,,Bengaluru / Bangalore,AI Software Solutions Engineer. Job DescriptionIntel DPG AI group focuses on developing disruptive solutions that will shape the future of AI and Deep Learning computing. Led ,"dsp  ,  c    ,  software design  ,  storage  ,  artificial intelligence  ,  git  ,  devops  ,  linux  ,  software engineering  ,  image processing  ,  python  ,  gdb  ,  c   programming  ,  unix"
39,AI Software Solution Engineer ,    Intel Technologies,4 - 7 yrs,,Bengaluru / Bangalore,"AI Software Solution Engineer Job DescriptionWorks with internal engineering teams and external partners ,  customers ,  and ISVs to deliver optimized AI solutions using Intel","algorithms  ,  cuda  ,  c    ,  artificial intelligence  ,  debugging  ,  software engineering  ,  big data  ,  python  ,  c  ,  problem solving  ,  machine learning"
40,AI Software Solutions Engineer ,    Intel Technology India Pvt Ltd,0 - 3 yrs,,Bengaluru / Bangalore,"AI Software Solutions Engineer Job DescriptionWe are looking for a dynamic compiler engineer to design ,  develop and optimize for performance ,  of compilers for Intel's deep","Information Systems  ,   Computer Science  ,   Computer Engineering  ,  Software Engineering"
41,AI Software Solutions Engineer ,    Intel Technology India Pvt Ltd,0 - 3 yrs,,Bengaluru / Bangalore,"AI Software Solutions Engineer Job DescriptionWe are looking for a dynamic compiler engineer to design ,  develop and optimize for performance ,  of compilers for Intel's deep","Information Systems  ,   Computer Science  ,   Computer Engineering  ,  Software Engineering"
42,AI Software Solutions Engineer ,    Intel Technology India Pvt Ltd,6 - 9 yrs,,Bengaluru / Bangalore,"AI Software Solutions Engineer Job DescriptionYou will be working on cutting edge problems in Deep Learning for Intel AI Accelerator SW Stack in a fast paced ,  dynamic and st","algorithms  ,  c    ,  ece  ,  storage  ,  artificial intelligence  ,  debugging  ,  software engineering  ,  python"
43,AI Frameworks Validation Engineer ,    Intel Technology India Pvt Ltd,0 - 3 yrs,,Bengaluru / Bangalore,"AI Frameworks Validation Engineer Job DescriptionConducts design and development to build and optimize AI software. Designs ,  develops ,  and optimizes for AI frameworks  ( e","algorithms  ,  machine learning  ,  artificial intelligence  ,  data communication  ,  software engineering"
44,      Automation Engineer AI / ML ,    Parallel Wireless,4 - 6 yrs,,Bengaluru / Bangalore,"- Develop automated test cases to test AI applications- Integrate automation test cases with the CI and CD framework- Review software requirements ,  design to create automati","rest api  ,  software requirements  ,  sql  ,  docker  ,  java  ,  linux  ,  telecom  ,  software engineering  ,  perl  ,  python  ,  mobile  ,  team player  ,  infrastructure"
45,AI Frameworks Validation Engineer ,    Intel Technologies,0 - 3 yrs,,Bengaluru / Bangalore,"AI Frameworks Validation Engineer Job DescriptionConducts design and development to build and optimize AI software. Designs ,  develops ,  and optimizes for AI frameworks  ( e","algorithms  ,  machine learning  ,  artificial intelligence  ,  data communication  ,  software engineering"
46,      Automation Engineer - AI Flagship ,    Schneider Electric Pvt Ltd,2 - 5 yrs,,Bengaluru / Bangalore,Automation Engineer - AI Flagship - 0078AWRoles  &  ResponsibilitiesBuild and development of a given business operational process automation ensuring it adhere to required dev,"information technology  ,  .net technologies  ,  exception handling  ,  api  ,  business applications  ,  c#  ,  python  ,  problem solving  ,  project delivery  ,  software support  ,  c#.net"
47,AI SW Solution Engineer ,    Intel Technologies,8 - 15 yrs,,Bengaluru / Bangalore,AI SW Solution Engineer Job DescriptionIntel DPG AI group focuses on developing disruptive solutions that will shape the future of AI and Deep Learning computing. Led by top t,"dsp  ,  c    ,  software design  ,  storage  ,  artificial intelligence  ,  git  ,  devops  ,  linux  ,  software engineering  ,  image processing  ,  python  ,  gdb  ,  c   programming  ,  unix"
48,AI SW Solution Engineer ,    Intel Technologies,8 - 15 yrs,,Bengaluru / Bangalore,AI SW Solution Engineer Job DescriptionIntel DPG AI group focuses on developing disruptive solutions that will shape the future of AI and Deep Learning computing. Led by top t,"dsp  ,  c    ,  software design  ,  storage  ,  artificial intelligence  ,  git  ,  devops  ,  linux  ,  software engineering  ,  image processing  ,  python  ,  gdb  ,  c   programming  ,  unix"
49,AI SW Solution Engineer ,    Intel Technology India Pvt Ltd,8 - 15 yrs,,Bengaluru / Bangalore,Job Type: Experienced HireAI SW Solution Engineer Job DescriptionIntel DPG AI group focuses on developing disruptive solutions that will shape the future of AI and Deep Learni,"dsp  ,  c    ,  software design  ,  storage  ,  artificial intelligence  ,  git  ,  devops  ,  linux  ,  software engineering  ,  image processing  ,  python  ,  gdb  ,  c   programming  ,  unix"
50,AI SW Solution Engineer ,    Intel Technology India Pvt Ltd,8 - 15 yrs,,Bengaluru / Bangalore,"? Bachelors  /  Masters Degree in Computer Science ,  Electronics Engineering ,  Mathematics ,  or related field of study with 8-15 years of relevant experience.? Experience w","dsp  ,  c    ,  software design  ,  storage  ,  artificial intelligence  ,  git  ,  devops  ,  linux  ,  software engineering  ,  image processing  ,  python  ,  gdb  ,  c   programming  ,  unix"
51,      Analyst / Engineer-AI / ML ,    APPLYCUP HIRING SOLUTIONS LLP,2 - 4 yrs,,"Delhi,  Delhi/NCR","Qualification : BE  , Btech  , BSC Computer / IT , MSC  , MCA , any graduate ,  Experience : 2 - 4 YearsSkills : Python ,  Java and R ,  Machine Learning EngineeJob Descriptio","algorithms  ,  python  ,  machine learning  ,  java  ,  data structures"
52,AI Software Development Engineer ,    Intel Technology India Pvt Ltd,10 - 13 yrs,,Bengaluru / Bangalore,AI Software Development Engineer Job DescriptionJob Description: We are looking for experienced software engineers to join our Client AI team responsible for development of Wi,"cuda  ,  c    ,  graphics  ,  embedded software development  ,  api  ,  c  ,  operating system  ,  kernel  ,  cl  ,  windows  ,  high performance computing"
53,AI Software Development Engineer ,    Intel Technology India Pvt Ltd,5 - 8 yrs,,Bengaluru / Bangalore,AI Software Development Engineer Job DescriptionJob Description: We are looking for experienced software engineers to join our Client AI team responsible for development of Wi,"cuda  ,  c    ,  graphics  ,  embedded software development  ,  api  ,  c  ,  operating system  ,  kernel  ,  cl  ,  windows  ,  high performance computing"
54,AI Software Development Engineer ,    Intel Technologies,5 - 8 yrs,,Bengaluru / Bangalore,AI Software Development Engineer Job DescriptionJob Description: We are looking for experienced software engineers to join our Client AI team responsible for development of Wi,"cuda  ,  c    ,  graphics  ,  embedded software development  ,  api  ,  c  ,  operating system  ,  kernel  ,  cl  ,  windows  ,  high performance computing"
55,AI Software Development Engineer ,    Intel Technologies,10 - 13 yrs,,Bengaluru / Bangalore,Job Type: Experienced HireAI Software Development Engineer Job DescriptionJob Description: We are looking for experienced software engineers to join our Client AI team respons,"cuda  ,  c    ,  graphics  ,  embedded software development  ,  api  ,  c  ,  operating system  ,  kernel  ,  cl  ,  windows  ,  high performance computing"
56,AI Software Solution Engineer ,    Intel Technology India Pvt Ltd,4 - 7 yrs,,Bengaluru / Bangalore,"AI Software Solution Engineer Job DescriptionWorks with internal engineering teams and external partners ,  customers ,  and ISVs to deliver optimized AI solutions using Intel","algorithms  ,  cuda  ,  c    ,  artificial intelligence  ,  debugging  ,  software engineering  ,  big data  ,  python  ,  c  ,  problem solving  ,  machine learning"
57,AI Software Development Engineer ,    Intel Technology India Pvt Ltd,0 - 3 yrs,,Bengaluru / Bangalore,AI Software Development Engineer Job DescriptionBuild framework for supporting secure AI heterogenous workloads  ( GPU   VPU )  on ChromeOS. Framework should dynamically switc,"c    ,  python  ,  c  ,  linux operating system  ,  ubuntu  ,  linux scripting  ,  fedora  ,  written communication"
58,AI software Solutions Engineer ,    Intel Technology India Pvt Ltd,0 - 3 yrs,,Bengaluru / Bangalore,"AI software Solutions Engineer Job DescriptionIntel's Internet of Things Group runs Intel's Edge / IOT business. Within that group ,  the Developer Tools   Applications team i","c    ,  artificial intelligence  ,  software engineering  ,  python  ,  c"
59,      Principal Engineer - AI Engine ,    Xilinx India Technology Services Pvt Ltd,15 - 18 yrs,,Hyderabad/Secunderabad,"Developing great technology takes more than talent: it takes amazing people who understand collaboration ,  respect ,  and who will go the extra mile to achieve unthinkable re","physical design  ,  soc  ,  rtl design  ,  system verilog  ,  verification  ,  systemc  ,  cpu  ,  uvm  ,  verilog"
60,      Artificial Intelligence  ( AI )  Software Engineer ,    APPLYCUP HIRING SOLUTIONS LLP,2 - 5 yrs,,Bengaluru / Bangalore,"Artificial Intelligence  ( AI )  Software EngineerBangalore ,  KarnatakaSkills : C   ,  Java ,  .net ,  REST / SOAP API standards ,  java ,  javascript ,  html5 / CSS and Pyth","c    ,  css  ,  html5  ,  artificial intelligence  ,  java  ,  google api  ,  devops  ,  software engineer  ,  api  ,  big data  ,  rest  ,  python  ,  github  ,  javascript  ,  written communication  ,  .net  ,  soap"
61,      Artificial Intelligence  ( AI )  Software Engineer ,    FUGENX TECHNOLOGIES,2 - 5 yrs,,Bengaluru / Bangalore,"Experience Required : 2  4 years ExperienceSkills Required: : BE / B TECH  ( Computer Science  /  IT )  ,  MCA ,  BBM ,  MBA.Job Location : BangaloreThe position requires a de","c    ,  css  ,  html5  ,  artificial intelligence  ,  java  ,  google api  ,  devops  ,  api  ,  big data  ,  rest  ,  github  ,  python  ,  javascript  ,  written communication  ,  .net  ,  soap"
