Sr. No.,Job Title,Company Name,Experience Required,Salary,Location,Job Description,Key Skills
399,"      Mechanical Engineer , Mechanical Engineer , Engineer , Mechanic ",    SWATI,10 - 15 yrs,₹Rs 10.00 - 25.00 Lacs p.a.,"Ahmedabad,  Bengaluru / Bangalore,  Kolkata,  Mumbai,  Pune","Position DescriptionWe are seeking a number of Mechanical Engineers to join Onshore Department. The department receives offshore crude production ,  processing and shipping th","Cad  ,  Auto Cad  ,  design engineer  ,  lead engineer  ,  Design Engineering  ,  CAD Development CAD Drafting  ,  Engineering  ,  Manufacturing  ,  Mechanical  ,  Industrial  ,  Plc  ,  Instrumentation"
400,      DevOps Engineer ,    TIGI HR SOLUTION PVT. LTD.,6 - 8 yrs,,"Hyderabad/Secunderabad,  Pune,  Nagpur,  Other City(s) in Maharashtra",Roles and ResponsibilitiesWork with the Technical Product Owner and Tech Lead to define and expand the teams roadmapExpediting the migration of our VMWare-based application st,"AWS  ,  Docker  ,  Kubernetes  ,  Kubernetes"
401,      Site Engineer ,    Vasantdada Sugar Institute,4 - 5 yrs,₹Rs 4.20 - 5.40 Lacs p.a.,Pune,"Job Title:Walk-in-interview for the Post of Site Engineer  ( 03 posts )  at Civil Engineering Department on 19 / 05 / 2022 at 2.00 pmCompensation  ( Per month ) :Up to Rs.45 ,","Planning  ,  Execution  ,  Site inspection  ,  Day to day Supervisor  ,  running bills  ,  estimates
        
       
directions_walk
Walk-in Details 19-May-2022 - 19-May-2022  02:00 PM - 02:30 PM   Civil Engineering Department of Vasantdada Sugar Institute, Manjari (Bk), Tal. Haveli, Dist. Pune 412307
"
402,      Sales engineer ,    Sudeep Consultancy,1 - 2 yrs,,"Bengaluru / Bangalore,  Chennai",* Delhi based Pvt Ltd company urgently required candidates for*Sales engineer* to sell machines tools of international brands in Tamil Nadu. Based in *Bangalore  /  Chennai** ,"Sales  ,  Marketing  ,  Sales Engineer  ,  Cold Calling  ,  Business Development  ,  Lead Generation  ,  Inside Sales  ,  senior sales engineer  ,  Telemarketing  ,  Telesales  ,  Telecaller"
403,      Automation Engineer ,    D S Business Services,1 - 3 yrs,₹Rs 1.20 - 3.00 Lacs p.a.,Ahmedabad,"Automation EngineerLocation : Vatva| Prahladnagar | AhmedabadDesign Processes associated with Digital measuring system.designed Electrical Schematics and Control Panels ,  HMI","Automation Engineer  ,  PLC  ,  SCADA  ,  HMI  ,  Siemens  ,  Delta"
404,      Software Engineer ,    Electrobrain modern technologies pvt ltd,1 - 4 yrs,₹Rs 3.50 - 6.50 Lacs p.a.,"Delhi,  Delhi/NCR,  Gurgaon,  Noida/Greater Noida","Job DescriptionRoles and ResponsibilitiesParticipate in training ,  methodology ,  and enablementBegin participation in field activities with clients by shadowing seasoned arc","Cloud  ,  API  ,  Java  ,  c ++  ,  c  ,  Programming  ,  Mule Esb  ,  Big Data  ,  Perl  ,  talkEAISQLRamp  ,  CobolJavascript  ,  Python  ,  Net  ,  Salesforce  ,  salesforce  ,  biz"
405,      Network Engineer ,    PES HR SERVICES,1 - 4 yrs,,"Mumbai,  Navi Mumbai","Urgent opening for Desktop Support Engineer in reputed MNC company.Exp - 1+ YearReady to work from Office /  Desktop Level 1Roles and Responsibilities:OS Installation ,  confi","troubleshooting  ,  installation  ,  configuration  ,  technical support  ,  hardware support  ,  desktop support  ,  support engineer
 

"
406,"      Production  /  Quality Engineer , Production Engineer ",    Sahyog Jobs Consultancy,5 - 10 yrs,,"Bengaluru / Bangalore,  Delhi/NCR,  Pune,  Baddi,  Lucknow",Job DescriptionProduction  / Quality EngineerJob descriptionRoles and ResponsibilitiesPreparing  &  implementing standard quality procedures / parameter.To carry out proto ins,"Production   /   Quality Engineer
 

"
407,      PENETRATION ENGINEER ,    Logify Inc,2 - 5 yrs,₹Rs 5.00 - 8.00 Lacs p.a.,Mumbai,Job descriptions:1. Vulnerability scanning of web sites / api / servers using security tools and manual identification of vulnerabilities that cannot be replicated with tools2,"burpsuite  ,  nmap  ,  sqlmap  ,  http protocol  ,  dns  ,  sql  ,  xxs attack  ,  csrf  ,  react js  ,  gulp  ,  webpack"
408,      Mechanical Engineer ,    DHR Tech Solutions,0 - 3 yrs,₹Rs 3.50 - 6.00 Lacs p.a.,"Bengaluru / Bangalore,  Chennai,  Hyderabad/Secunderabad,  Kolkata,  Mumbai","Mechanical Engineer required ,  Diploma  /  Degree in mechanical engineering. Candidate would be responsible for Identify customer requirements.design systems and products. Re","design engineering  ,  Mechanical Engineering  ,  Mechanical Maintenance  ,  mechanical operation  ,  Mechanical Design  ,  machinery design  ,  B - tech  ,  BE  ,  diploma"
409,      Plumbing Engineer ,    V P Placement,11 - 16 yrs,₹Rs 34.45 - 53.85 Lacs p.a.,"Kolkata,  Cochin/ Kochi/ Ernakulam,  Lucknow,  Beirut,  null",Plumbing Engineers design hot and cold water systems for a house during the building process. Example resumes in this field indicate duties such as designing plumbing fixtures,"Ac  ,  pipping  ,  Pumps  ,  Preventive Maintenance  ,  Maintenance  ,  Facilities  ,  pipe fitting  ,  Welding  ,  Piping Welding  ,  Piping Layouts  ,  Piping  ,  Hvac"
410,      Control Engineer ,    Krazy Mantra HR Solution Pvt. Ltd,6 - 10 yrs,₹Rs 14.00 - 20.00 Lacs p.a.,Hyderabad/Secunderabad,"Looking for multiple self-motivated engineers with expertise in HVAC Controls Algorithm development using Model based Tools.this Controls Engineer will work with global ,  cro","Control Engineer  ,  MATLAB  ,  Simulink  ,  RTOS  ,  HVAC  ,  Algorithm Development  ,  Software-In-The-Loop  ,  Control Analysis  ,  Control Design"
411,      Safety Engineer ,    Gourav Consultants,2 - 7 yrs,₹Rs 4.10 - 20.50 Lacs p.a.,"Ahmedabad,  Bengaluru / Bangalore,  Chennai,  Gurgaon,  Kolkata",Safety Engineer is a person responsible for ensuring the perfect functioning of machines that can cause life-critical hazards if any of their parts go missing or fail. Safety ,Safety Engineer is a person responsible for ensuring the perfect functioning of
412,      Ships Engineer ,    V P Placement,10 - 15 yrs,₹Rs 9.00 - 23.00 Lacs p.a.,"Adilabad,  Kurnool,  Nellore,  Nizamabad,  Ongole","Marine engineers design ,  construct ,  maintain ,  and repair a variety of maritime vessels including cargo ships ,  cruise liners ,  and oil rigs. They apply their engineeri","Critical thinking and problem solving.  ,  Teamwork and collaboration.  ,  Professionalism and strong work ethic.  ,  Oral and written communications skills.  ,  Leadership."
413,      Chemical Engineer ,    V P Placement,10 - 15 yrs,₹Rs 30.55 - 70.90 Lacs p.a.,"Ahmedabad,  Chennai,  Kolkata,  Ahmednagar,  Beirut","Chemical Engineers are professionals who use their knowledge of the physical sciences to improve operations and equipment used in the processing of chemicals ,  fuel ,  drugs ","Chemistry  ,  Physics  ,  Biology  ,  Mathematics  ,  IT  ,  Project management  ,  Process design  ,  Resource management  ,  Design skills  ,  Science skills  ,  Computer skills  ,  Interpersonal skills"
414,      Software Engineer ,    IT Mantra Techintellect  Private Limited,4 - 8 yrs,₹Rs 5.50 - 11.50 Lacs p.a.,"Mumbai,  Navi Mumbai","Sr.software developer.netMVCORACLE 11GAngularAPIJavascriptWEB APIShould be able to debug code to identify the issues in the backend code.Oracle - Queries ,  Stored Procedures ","Software Developer .net  ,  software developer"
415,      HARDWARE ENGINEER ,    Lenire Consulting Group,2 - 7 yrs,₹Rs 1.00 - 2.40 Lacs p.a.,Mumbai,"We have an urgent vacancy for the post of ""HARDWARE ENGINEER"" for an IT cell of a corporate office of renowned company.Location-Andheri East MIDC.Requirement :Hardware  &  Net","server  ,  router configuration  ,  Camer DVR"
416,      Network Engineer ,    dynamic computer services,2 - 5 yrs,,Chennai,Network Fundamentals: Understanding of networking hardware from multiple vendors including open source. Candidate should possesses understanding of DC scenarios with experienc,"Routing Switching  ,  LAN WAN Telecommunication  ,  Cisco  ,  Load balancing  ,  wireless  ,  VPN technology"
417,      Estimation Engineer ,    Samrit Halam,1 - 6 yrs,₹Rs 1.15 - 1.25 Lacs p.a.,"Ahmedabad,  Bengaluru / Bangalore,  Chennai,  Hyderabad/Secunderabad,  Kolkata","The estimation engineer job description entails determining the scope of the project ,  reviewing of preliminary data and deliverables such as proposal specifications and draw","to enjoy working as part of a team.  ,  good written skills  ,  good communication skills"
418,"      ""sales engineer"" ",    Jobs Plan Dot Com,2 - 7 yrs,₹Rs 3.00 - 8.00 Lacs p.a.,"Bengaluru / Bangalore,  Hyderabad/Secunderabad,  Guwahati","Role  Sales EngineerLocation   Guwahati ,  Bangalore ,  HyderabadQualification  Any Graduate  ( B.E. /  B. Tech /  Diploma / BSC ) Experience - 3 to 8 yearsJob Role - 1. Ident","sales  ,  marketing  ,  equipment  ,  tool  ,  manufacturing  ,  automation  ,  machine  ,  food  ,  pharma  ,  packaging"
419,      ESTIMATION ENGINEER ,    JY consultancy,3 - 4 yrs,₹Rs 3.50 - 3.60 Lacs p.a.,Indore,"1 . ESTIMATION ENGINEER5 POSTS ) EDUCATION- B. CIVIL IS A MUST WITH A MINIMUM OF 3 YEARS EXPERIENCE IS MUST.ONLY MALES CAN APPLYKNOWLEDGE OF AUTOCAD ,  MS EXCEL CALCULATION PR","KNOWLEDGE OF AUTOCAD  ,   MS EXCEL CALCULATION PREPARE BOQ  ,   SCHEDULE OF RATES  ,   PWD  ,   CPWD RATES KNOWLEDGE"
420,      DevOps Engineer ,    Electrobrain modern technologies pvt ltd,4 - 9 yrs,,"Bengaluru / Bangalore,  Chennai,  Hyderabad/Secunderabad,  Mangalore,  Mysoru / Mysore","Job DescriptionMust-HaveAWS Cloud ,  Kubernetes ,  AWS EKS ,  Docker ,  ELKGood Experience in writing Dockerfile ,  Kubernetes objectconfiguration file  ( Kubernetes YAML file","AWS  ,  AWS Cloud  ,  Kubernetes  ,  AWS EKS  ,  Docker  ,  ELK  ,  IAC  ,  Terraform  ,  Dockerfile  ,  Kubernetes YAML  ,  Helm Creation  ,  CI  /  CD pipelines  ,  Jenkins  ,  Spinnaker.io  ,  Argo CD  ,  Kubespray"
421,      Chemical Engineer ,    JDC Recruitment Services,5 - 7 yrs,₹Rs 4.00 - 8.00 Lacs p.a.,"Bhopal,  Gwalior,  Indore,  Jabalpur,  Katni","Perform chemical analysis and physical property testing of materials and products.Research ,  design ,  and develop new production processes.Coordinate and perform tests.analy","Chemical  ,  Engineer  ,  Production  ,   Process Engineer  ,  "
422,      Planning Engineer ,    Samrit Halam,3 - 8 yrs,₹Rs 3.30 - 7.50 Lacs p.a.,"Bengaluru / Bangalore,  Chennai,  Mumbai,  Ludhiana,  Jaipur","The Senior Planning Engineer is responsible for the overall evaluation and control of the assigned project schedules and performs schedule development ,  maintenance and monit","Planning Designing  ,  Planning Urban Infrastructure Projects  ,  Planning Execution"
423,      Field engineer ,    Samrit Halam,5 - 10 yrs,₹Rs 5.25 - 7.35 Lacs p.a.,"Bengaluru / Bangalore,  Chennai,  Delhi,  Mumbai,  Thiruvananthapuram",Field engineers oversee construction sites. They typically hold a bachelor's degree and have several years of construction experience. Field engineers perform the following fu,"Well-versed in technical aspects of field projects  ,   including machinery and equipment.  ,  An analytical mind and strong problem-solving ability."
424,"      ""SERVICE ENGINEER"" ",    CRESCENDO MANPOWER CONSULTANCY PRIVATE LIMITED,0 - 3 yrs,₹Rs 1.40 - 1.90 Lacs p.a.,Other City(s) in Goa,"We have an opening for Indo Japanease CompanyPosition- Service EngineerLocation - GoaSalary details  upto  15 , 000 to 16 , 000 pm  ( negotiable )  + incentive  &  statutory b","""SERVICE ENGINEER""  ,  ""SERVICE""  ,  ""DIPLOMA""  ,  ""ITI"""
425,      Design Engineer ,    2COMS Consulting Pvt Ltd,2 - 5 yrs,,Bhilai-Durg,"1. 2 years experience in independently leading design %26 engineering team.  2. Responsible for studying tender documents and enquiries ,  and providing design and engineering","Design Engineer
 

"
426,      Commissioning engineer ,    Samrit Halam,2 - 7 yrs,₹Rs 5.40 - 8.50 Lacs p.a.,"Chennai,  Delhi,  Kolkata,  Mumbai,  Chandigarh","Monitor installation ,  submittals and usage of engineering tools adhering to project and commissioning guidelines. Guide testing processes and motivate specialists to achieve","Teamwork. As an engineer with any employer  ,   youre unlikely to find yourself working in solitary confinement. .  ,  Find out exactly what the employer wants."
427,Engineer-PPC ,    SR Consulting,3 - 4 yrs,,Hyderabad/Secunderabad,ResponsibilitiesCoordinate production workflow for one or multiple productsPlan and prioritize operations to ensure maximum performance                                     and,"Production Planning  ,  Material planning  ,  manpower planning  ,  maintaining production records  ,  daily production records"
428,      Data Engineer ,    Electrobrain modern technologies pvt ltd,2 - 7 yrs,,"Bengaluru / Bangalore,  Chennai,  Hyderabad/Secunderabad","Urgent Hiring Data EngineerDear Candidates , Greetings!!It's been a immense pleasure to inform you one of the manufacturing Industry deals in to Dataand other Data Engineer pr","Data Science  ,  Power Bi  ,  Analysis Services  ,  Data Management  ,  Data Analysis  ,  Machine Learning  ,  Large-scale Computing"
429,      MIS Engineer ,    gupta associates,5 - 10 yrs,₹Rs 3.00 - 6.00 Lacs p.a.,"Delhi,  Delhi/NCR,  Gurgaon,  Noida/Greater Noida,  Faridabad",MIS  &  BI Executive Experience: 5-10 yearsRoles And Responsibilities: Understand business requirements in BI context and design data models to transform raw data into meaning,"SQL Programming  ,  MIS Report  ,  mis power bi  ,  advanced excel"
430,      Service Engineer ,    Sudeep Consultancy,0 - 1 yrs,,Bengaluru / Bangalore,* Delhi based Pvt Ltd company urgently required candidates for*Service Engineer*for machines tools of international brands Based in Bangalore * Qualification: Degree or diplom,"machines tools of international brands Based in Bangalore  ,  proficient communication skills in English  ,  travel  ,  will have to travel in south India  ,  engg deg or dip"
431,      purchase engineer ,    SHRI MARUTI PLACEMENT SERVICES,2 - 4 yrs,,Ghaziabad,"Dear to all , we have urgent requirement in Purchase engineer profile.candidate should have knowledge in SAP.Experience : 2 to 4 yearSalary : 4 lac ctc  per annumLocation : Gh","Sap
        
       
directions_walk
Walk-in Details 20-Apr-2022 - 18-Jun-2022  11:00 AM - 03:00 PM   Meerut road ghaziabad
"
432,      Electrical Engineer ,    Yashodhara Management,1 - 4 yrs,₹Rs 1.40 - 2.45 Lacs p.a.,"Bhiwandi,  Dombivali,  Kalyan,  Mumbai,  Navi Mumbai",Urgent Job Vacancy For  BE ELECTRICAL ENGINEERING freshers and experienced candidates can aaplyApply Post :ELECTRICAL ENGINEERINGSalary - 12 to 25kJob Location :  NAVI MUMBAI ,"DIPLOMA  ,  BE ELECTRICAL ENG  ,  Engineering"
433,      Geotechnical engineer ,    Samrit Halam,4 - 8 yrs,₹Rs 4.25 - 7.35 Lacs p.a.,"Chennai,  Mumbai,  Noida/Greater Noida,  Nizamabad,  Itanagar",Primary duties: A geotechnical engineer assesses the local environment where a proposed-project will likely be built. They also identify environmental risk factors that could ,"the ability to explain your findings and give advice clearly and concisely  ,   including in written reports.  ,  an investigative mind and problem-solving skills"
434,      Structural engineer ,    Samrit Halam,4 - 8 yrs,₹Rs 3.20 - 7.30 Lacs p.a.,"Bengaluru / Bangalore,  Chennai,  Mumbai,  Chandigarh,  Rajahmundry","Structural engineers focus on the structural integrity of construction projects such as buildings ,  bridges and roads. They also create plans and processes to maintain and re","Previous experience as a Structural Engineer or similar field.  ,  Excellent knowledge of construction methods and regulations.  ,  Hands-on experience with AutoCAD."
435,      Electronic Engineer ,    Yashodhara Management,0 - 2 yrs,₹Rs 1.80 - 3.50 Lacs p.a.,"Dombivali,  Kalyan,  Mumbai,  Navi Mumbai,  Thane",Vacancy for Electronic Engineer fresher and exp candidateEducation - Diploma / BE  Electronic EgnineerLocation - Ambernath / navi Mumbai / Dombivali / MumbaiIndustry type - Ma,Diploma   /   BE Electronic
436,      Design engineer ,    Samrit Halam,4 - 9 yrs,₹Rs 4.25 - 6.45 Lacs p.a.,"Ahmedabad,  Chennai,  Delhi,  Kolkata,  Mumbai",Design engineers research and develop ideas for new products and the systems used to make them. They also work to improve the performance and efficiency of existing products.I,"Design Engineering  ,  Design General Engineering  ,  Design Enterprise Technology Architecture  ,  Design Compiler"
437,      Manufacturing Engineer ,    Sahyog Jobs Consultancy,10 - 15 yrs,₹Rs 10.00 - 15.00 Lacs p.a.,"Delhi/NCR,  Pune,  Indore,  Jaipur,  Lucknow",Manufacturing EngineerQualificationsDiploma in Mechanical or Equivalent 10-15 Years in Manufacturing engg ProcessPlanning Experience Level Job description  10-15 years Experie,"Mechanical  ,  Manufacturing  ,  Industrial  ,  Engineering  ,  Programming"
438,      Design Engineer ,    JDC Recruitment Services,4 - 7 yrs,₹Rs 4.00 - 8.00 Lacs p.a.,"Calicut/ Kozhikode,  Cochin/ Kochi/ Ernakulam,  Kannur,  Kollam,  Kottayam","Making Drawing ,  Dimensional drawing ,  Cross-Sectional drawing for PumpsNew Design ,  DevelopmentsOrganize and maintain existing engineering recordsConstruct prototype and c","Design Engineer  ,  Drawing  ,  solid work  ,    ,  Autocad"
439,      Sales Engineer ,    Control Print Limited,2 - 7 yrs,₹Rs 2.00 - 5.40 Lacs p.a.,Bengaluru / Bangalore,To drive the Sales of printers for Control Print Limited in a particular assigned territory.Ensure Training  / Seminars for Customers on the existing as well as new products a,"""technical sales""  ,  ""oem sales""  ,  ""industrial sales""  ,  ""equipment sales""  ,  ""marketing engineer""  ,  ""capital equipment""  ,  ""industrial marketing"""
440,"      Mechanical Engineer , Petroleum Engineer , Mine Engineer , Mining ",    SWATI,2 - 7 yrs,,"Bengaluru / Bangalore,  Mumbai,  Pune,  Vadodara","We have an ongoing recruitment program in the upstream oil and gas industries.As an organisation which values individual potentials ,  our policy is to recruit talented indivi","Engineering  ,  Mining Operations  Supervisory  ,  Computer  ,  Chemical Analysis  ,  Hplc  ,  lab  ,  Engineering Electrical Chemical Mechanical"
441,"      Site Engineer , Civil Structural Engineer , Engineer ",    V P Placement,14 - 19 yrs,₹Rs 10.00 - 12.00 Lacs p.a.,"Delhi/NCR,  Kolkata,  Mumbai,  Beirut,  null","The site engineer's responsibilities include managing different parts of construction projects ,  supervising crew members ,  preparing estimates for time and material costs ,","Environment  ,  Civil  ,  Engineering  ,  Programming"
442,      sales engineer ,    Control Print Limited,3 - 8 yrs,₹Rs 1.00 - 5.40 Lacs p.a.,Noida/Greater Noida,JD To drivethe Salesof printersfor ControlPrint Limitedin aparticular assignedterritory. Ensure Training / Seminars forCustomers onthe existingas wellas newproducts andany new,"""sales enginner""  ,  ""marketing egnieer""  ,  ""oem""  ,  ""technical sale"""
443,      Assembly Engineer ,    K Ponraj,1 - 6 yrs,₹Rs 4.10 - 7.15 Lacs p.a.,"Bengaluru / Bangalore,  Chennai,  Kolkata,  Mumbai,  Noida/Greater Noida",URGENT RECRUITMENT AT Best Supermarket :Interested candidate / Workers are advised to submit their CV to  for consideration towe are looking to fill the positions listed bello,"supervisor  ,  agency supervisor  ,  Customer service representative  ,  asst sales manager  ,  Marketing  ,  marketing executive  ,  assistant sales manager  ,  assistant manager"
444,      Service Engineer ,    Ameyash Solutions,0 - 3 yrs,₹Rs 2.00 - 5.00 Lacs p.a.,Pune,Greetings From Ameyash Solutions!!We have some urgent openings for Produciotn Engineer our reputed clients based in Pune.Contact-7070941754  ( Megha ) Exp - 0 to 3  yearsGende,"Fresher  ,  trainee  ,  Maintenance  ,  Preventive Maintenance  ,  Chillers  ,  7
        
       
directions_walk
Walk-in Details 16-May-2022 - 17-May-2022  09:00 AM - 06:00 PM   Venue-Pune

For More Details Contact-

7070941754 

Megha
 
"
445,      Chemical Engineer ,    Gourav Consultants,8 - 13 yrs,₹Rs 8.40 - 19.45 Lacs p.a.,"Ahmedabad,  Bengaluru / Bangalore,  Kolkata,  Mumbai,  Noida/Greater Noida","Chemical engineers develop and design chemical manufacturing processes. Chemical engineers apply the principles of chemistry ,  biology ,  physics ,  and math to solve problem",Chemical engineers develop and design chemical manufacturing processes.
446,"      Senior Software Engineer , Software Engineer ",    INNERGIE SOLUTIONS,3 - 7 yrs,₹Rs 10.00 - 13.00 Lacs p.a.,Delhi,"Must have Angular min. 2+ year's working experience.Good working knowledge of .net ,  Asp.net ,  c# ,  Web API ,  Web  ( ASP.net ,  JQuery  ,  JavaScript )  ,  HTML ,  CSSStro","Angular  ,  SQL  ,  .net  ,  ASP .net c#  ,  j query  ,  java script  ,  html"
447,      Sales Engineer ,    Jobs Plan Dot Com,3 - 8 yrs,,"Guwahati,  Jammu,  Other City(s) in Jammu & Kashmir,  Alwar","Position - Sales EngineerLocation - Bhiwadi ,  Jammu  &  Kashmir ,  GuwahatiQualification - B.E. /  B.Tech /  DiplomaExperience - 3 to 8 yearsJob Role -Identify ,  study custo","b2b  ,  industrial  ,  sales"
448,      Production Engineer ,    Ameyash Solutions,0 - 3 yrs,₹Rs 2.00 - 5.00 Lacs p.a.,Pune,Greetings From Ameyash Solutions!!We have some urgent openings for Produciotn Engineer our reputed clients based in Pune.Contact-7070941754  ( Megha ) Exp - 0 to 3  yearsGende,"Mechanical  ,  Manufacturing  ,  Engineering  ,  Fresher  ,  Production
        
       
directions_walk
Walk-in Details 16-May-2022 - 17-May-2022  09:00 AM - 06:00 PM   Venue-Pune

Walk In Date- 16th Feb & 17th Feb 2022

For More Details Contact-

7070941754 

Megha
 
"
449,"      Software Development Engineer , Software Engineer ",    success Placement Services,2 - 7 yrs,₹Rs 3.50 - 18.00 Lacs p.a.,Delhi,Software Engineer on application development on Java and C languages     Princeton based company .We develop GPS solutions over phone using Client server technique over phoneI,"software engineer  ,  software developer  ,  senior software developer  ,  project manager  ,  senior project manager  ,  Developer  ,  web developer  ,  web designer  ,  php developer"
450,      Application Engineer ,    Cynosure Corporate Solutions,5 - 10 yrs,,Chennai,"Job Description: The Application Engineers is at the forefront of Our Client. This position answers technical questions ,  troubleshoots audio ,  video ,  and telephony equipm","Application Engineer  ,  Software Technical Support  ,  cts  ,  avoip  ,  av integration  ,  ccna"
451,      Design Engineer ,    JDC Recruitment Services,4 - 7 yrs,₹Rs 4.00 - 8.00 Lacs p.a.,"Agra,  Aligarh,  Allahabad,  Bareilly,  Faizabad","Making Drawing ,  Dimensional drawing ,  Cross-Sectional drawing for PumpsNew Design ,  DevelopmentsOrganize and maintain existing engineering recordsConstruct prototype and c","Design Engineering  ,    ,  Drawing  ,  Solid work  ,   Autocad"
452,      Energy Engineer ,    V P Placement,1 - 6 yrs,₹Rs 1.95 - 12.00 Lacs p.a.,"Ahmedabad,  Guwahati,  Thiruvananthapuram,  Gangtok,  Agartala","We are Currently Open for Urgent Hiring at SINTANA ENERGY ,  CANADA ,  Positions: Energy Engineer ,  Process Executive ,  Senior Process Associate ,  Business Process Associat","Energy Analysis  ,  Renewable Energy  ,  Oil Gas Construction  ,  Engineering  ,  Manufacturing"
453,      Quality Engineer  &  Production Engineer ,    DHR Tech Solutions,0 - 3 yrs,₹Rs 3.00 - 6.00 Lacs p.a.,"Bengaluru / Bangalore,  Chennai,  Hyderabad/Secunderabad,  Kolkata,  Mumbai",Roles and ResponsibilitiesHiring Candidates for production and quality department in production in charge / quality supervisor / ppc / final quality / customer quality / Junio,"Quality Analysis  ,  quality analyst  ,  qa engineer  ,  QA Testing  ,  Quality Assurance  ,  Quality Process  ,  Production QA  ,  quality engineer  ,  Quality Checks"
454,      Chemical Engineer ,    Induspect India Pvt ltd,3 - 8 yrs,,Surat,Job Responsibilities supervising plant operations  investigating and troubleshooting plant / process problems Responsible for developing new industrial processes and designing,"Chemical Process Engineering  ,  Plant"
455,      Software Engineer ,    HIRINGHUT SOLUTIONS PRIVATE LIMITED,3 - 5 yrs,,Chennai,"Mandatory SKILLS: -Strong experience in .net Core ,  WPF ,  MVVM ,  c# ,  OOPS concept ,  Multi-threading programming.Strong experience  in SQL Server.Experience in Web develo",".net core  ,  WPF"
456,      Implementation Engineer ,    A Square Group,1 - 4 yrs,₹Rs 2.00 - 4.00 Lacs p.a.,Chennai,"Understand customer requirement ,  map with the product ,  and do the configuration   Give training on the product to customers  &  clarify their doubts  Suggest or give ideas","configuration  ,  installation"
457,      Embedded engineer ,    JDC Recruitment Services,4 - 7 yrs,₹Rs 5.00 - 7.00 Lacs p.a.,"Chennai,  Coimbatore,  Cuddalore,  Erode,  Hosur","Firmware DevelopmentDevice Driver Development Design and development of Embedded Systems ,  Microprocessor and Microcontroller based productsStrong Embedded system development","Electronics  ,  Manufacturing"
458,"      Electrical Engineer  ( RF Engineer )  , Asistant Electrical Engineer ",    Electrobrain modern technologies pvt ltd,2 - 7 yrs,₹Rs 4.50 - 8.80 Lacs p.a.,"Delhi,  Delhi/NCR,  Gurgaon,  Noida/Greater Noida","Job DescriptionDesign or modify electrical / electronic engineering assemblies ,  layouts / schematics and / or detailed drawings / specifications of moderate scope under gene","Electrical Engineering.  ,  Automation Testing Engineering  ,  MATLAB  ,  Electrical Maintenance  ,  electrical supervisor  ,  Quality Surveying  ,  Machinery  ,  plc"
